session_id,scenario,condition,run,actor_model,PS,CC,ER,LF,RC,total,rationale
S1_A_r01_claude,S1,A,1,claude,4,4,4,4,4,20,"The nurse responds with reasonable confidence and respect, directly addressing the student's concern and reinforcing psychological safety by explicitly encouraging the student to speak up about medication issues. Communication is clear and structured, with accurate information exchanged. The nurse acknowledges and addresses the student's emotional state, providing reassurance and validation. There is a clear learning moment as the nurse explains the correct dosing and models escalation. The relationship is slightly strengthened through supportive feedback and encouragement."
S1_A_r01_gemini,S1,A,1,gemini,2,2,2,2,2,10,"The interaction is tense and rushed, with the nurse displaying impatience and the student showing clear hesitation and discomfort. Communication clarity is compromised by interruptions and lack of guidance. Empathic response is minimal; the nurse notices the student's uncertainty but does not address it supportively. There is little facilitation of learning beyond a directive to look up information, and the relationship appears strained with unresolved tension."
S1_A_r01_gpt4mini,S1,A,1,gpt4mini,3,4,3,4,3,17,"The nurse provides accurate and structured information, supporting learning by encouraging the student to use context and chart review (CC=4, LF=4). Psychological safety is moderate; the student is hesitant and apologetic, and the nurse is brisk but not overtly dismissive (PS=3). Empathic response is brief and mostly limited to practical advice rather than emotional support (ER=3). The relationship remains neutral—neither strengthened nor damaged, with some tension but no overt conflict (RC=3)."
S1_A_r02_claude,S1,A,2,claude,4,5,4,5,4,22,"The nurse creates a supportive environment, encouraging the student not to apologize for raising concerns and explicitly validating their instincts, which fosters psychological safety (4). Communication is clear, structured, and includes explicit SBAR instruction (5). Empathic response is present, with the nurse addressing the student's anxiety and reinforcing their actions (4). Learning facilitation is strong, with direct teaching, real-time coaching, and reinforcement of safety culture (5). Relationship continuity is slightly strengthened by mutual respect and encouragement, though not deeply personal (4)."
S1_A_r02_gemini,S1,A,2,gemini,2,2,2,2,2,10,"The interaction is tense, with the nurse displaying impatience and the student showing hesitation and stress, indicating low psychological safety. Communication is incomplete, with important details about the medication order left unresolved. Emotional cues from the student are noticed but not addressed by the nurse. There is minimal learning facilitation, as the nurse gives a directive without explanation. The relationship appears strained, with unresolved tension and no evidence of strengthened rapport."
S1_A_r02_gpt4mini,S1,A,2,gpt4mini,2,3,3,3,3,14,"The psychological safety is low; the student is hesitant and apologetic, and the nurse's responses are curt, emphasizing independence over support. Communication clarity is moderate, as the issue is discussed but not fully explored or confirmed. Empathic response is minimal, with brief acknowledgment but little emotional support. Learning facilitation is present but limited to generic advice rather than a clear teaching moment. Relationship continuity is neutral; the interaction is professional but lacks warmth or meaningful connection."
S1_A_r03_claude,S1,A,3,claude,4,5,4,5,4,22,"The nurse creates a reasonably confident and safe environment, especially after the initial hesitation, by explicitly affirming the student's actions and reinforcing the importance of speaking up. Communication is clear, structured, and complete, with all relevant information confirmed and acted upon. Empathic response is present and addressed, particularly in the nurse's direct feedback and encouragement. The learning facilitation is excellent, with a clear, memorable teaching moment about patient safety and self-trust. The relationship is slightly strengthened, as the nurse's support and acknowledgment likely build trust, though the interaction remains professional rather than deeply personal."
S1_A_r03_gemini,S1,A,3,gemini,2,2,2,2,2,10,"The student appears hesitant and apologetic, indicating low psychological safety, while the nurse's responses are brusque and do not foster a supportive environment. Communication is incomplete, with critical information (the dose) missing. Empathic response is minimal; the student's uncertainty is not acknowledged or supported. There is little educational value, as the nurse only instructs the student to check the dose without explanation. The interaction ends with unresolved tension, suggesting a strained relationship."
S1_A_r03_gpt4mini,S1,A,3,gpt4mini,2,3,2,2,2,11,"The psychological safety is low; the nurse is curt and dismissive, leading to minimal confidence and some stress for the student. Communication clarity is moderate, as the student’s concern is acknowledged but not fully explored or confirmed. Empathic response is minimal—the nurse notices the student's uncertainty but does not address it emotionally. Learning facilitation is limited; the nurse instructs the student to check resources but offers little guidance or support. Relationship continuity is strained, with unresolved tension and a transactional tone."
S1_A_r04_claude,S1,A,4,claude,4,4,4,4,4,20,"The interaction demonstrates reasonable confidence and mutual respect, with the nurse encouraging the student to speak up and validating their concern. Communication is clear and structured, with all relevant clinical details discussed. Emotional acknowledgement is present, as the nurse addresses the student's anxiety and affirms their actions. There is a clear learning moment about medication safety and professional responsibility. The relationship is slightly strengthened, as the student is reassured and supported for future situations."
S1_A_r04_gemini,S1,A,4,gemini,2,3,2,3,3,13,"The nurse's communication is abrupt and demanding, creating a stressful environment for the student and limiting psychological safety. Clarity is achieved only after repeated prompting, with minor omissions initially. Empathic response is minimal, as the nurse does not acknowledge the student's uncertainty or effort. There is some learning facilitation through directive advice, but it lacks depth or encouragement. The relationship remains neutral, with no overt harm but also no strengthening."
S1_A_r04_gpt4mini,S1,A,4,gpt4mini,2,3,2,2,2,11,"The psychological safety is low; the student appears hesitant and is shut down by the nurse, who is dismissive and offers minimal support. Communication clarity is moderate, as the student identifies a potential issue but the nurse does not confirm or clarify. Empathic response is poor; the nurse notices the student's concern but does not address it emotionally. Learning facilitation is minimal, with the nurse redirecting responsibility without explanation. Relationship continuity is strained, with unresolved tension and little sense of support or collaboration."
S1_A_r05_claude,S1,A,5,claude,3,4,3,4,3,17,"The interaction shows moderate psychological safety; the student is hesitant and apologetic, and the nurse is brusque but not overtly hostile. Communication clarity is high—the medication error is clearly identified and addressed. Empathic response is brief; the nurse acknowledges the student's correct observation but does not offer emotional support. Learning facilitation is clear, with direct feedback and a learning point about trusting one's knowledge. Relationship continuity is neutral; while the nurse's tone is terse, the student is not discouraged from future reporting, but the relationship is not noticeably strengthened."
S1_A_r05_gemini,S1,A,5,gemini,3,4,3,4,4,18,"The interaction shows moderate psychological safety; the student hesitates but is able to voice concerns, and the nurse responds directly though somewhat brusquely. Communication is clear and structured, with specific information exchanged. Empathic response is brief—the nurse acknowledges the student's uncertainty but does not offer emotional support. There is a clear learning moment as the nurse explains the rationale for dosing. The relationship is slightly strengthened as the nurse encourages follow-up, supporting ongoing dialogue."
S1_A_r05_gpt4mini,S1,A,5,gpt4mini,2,4,2,3,3,14,"The nurse's responses are terse and somewhat dismissive, creating a minimally safe environment where the student feels nervous and hesitant (PS=2). Communication is clear and structured, with instructions given, but lacks confirmation or collaborative discussion (CC=4). Emotional concerns are noticed but not addressed supportively (ER=2). There is some learning facilitation as the nurse encourages self-reliance, but it lacks depth or encouragement (LF=3). The relationship remains neutral; the student is not discouraged from future questions but is not meaningfully supported (RC=3)."
S1_B_r01_claude,S1,B,1,claude,4,4,4,4,4,20,"The student demonstrates reasonable confidence despite initial hesitation, and psychological safety is maintained as the nurse ultimately affirms the student's actions. Communication is clear and structured, with minor hesitations but no critical omissions. Empathic response is addressed, with the nurse acknowledging the student's correct action and offering practical advice. Learning facilitation is evident through direct feedback and a clear learning moment about medication safety and documentation. The relationship is slightly strengthened by the nurse's final supportive comments and trust in the student's vigilance."
S1_B_r01_gemini,S1,B,1,gemini,3,4,3,4,3,17,"The student demonstrates moderate hesitation and uncertainty, indicating some psychological safety but not full confidence. Communication is generally clear and structured, especially with repeated SBAR prompts, though the student omits some details initially. Empathic responses are brief; emotional concerns are acknowledged but not deeply addressed. There is a clear learning moment as the student is guided to use SBAR and check relevant information. The relationship remains neutral—there is no overt conflict, but also no evident strengthening."
S1_B_r01_gpt4mini,S1,B,1,gpt4mini,3,4,3,4,3,17,"The student demonstrates moderate hesitation and uncertainty, indicating some psychological safety but not full confidence. Communication is generally clear and structured, especially with repeated SBAR guidance, though the student’s statements remain tentative. Empathic responses are brief, with some emotional support from the mediator but little from the nurse. Learning facilitation is strong due to repeated, practical SBAR coaching. Relationship continuity is neutral; the interaction is professional but not notably strengthened."
S1_B_r02_claude,S1,B,2,claude,4,4,4,4,4,20,"The student demonstrates reasonable confidence, gradually becoming steadier and more assertive as the interaction progresses, indicating psychological safety. Communication is clear and structured, closely following SBAR guidance, with minor hesitations but no significant omissions. Empathic responses are present, with the nurse acknowledging the student's good instinct and the mediator providing supportive feedback. Learning facilitation is clear, as the nurse gives actionable steps and the mediator reinforces structured communication. The relationship is slightly strengthened, with mutual respect and positive reinforcement, though not deeply personal."
S1_B_r02_gemini,S1,B,2,gemini,4,4,4,4,4,20,"The dialogue demonstrates reasonable confidence and mutual respect, with the mediator providing supportive, structured guidance and the nurse responding without dismissiveness. Communication is clear and follows SBAR, though the student hesitates and requires prompting. Empathy is addressed with repeated normalization of nervousness. Learning is facilitated through stepwise feedback and modeling. The relationship is slightly strengthened by collaborative problem-solving and encouragement."
S1_B_r02_gpt4mini,S1,B,2,gpt4mini,3,4,3,4,3,17,"The student demonstrates moderate hesitation and uncertainty, indicating some psychological safety but not full confidence. Communication is generally clear and structured, especially with SBAR prompts, though some minor hesitancy persists. Empathic responses are brief and acknowledged but not deeply explored. There is a clear learning moment as the student understands the rationale for the dose, but the learning is not deeply reflective. The relationship remains neutral; there is no overt tension, but also no significant strengthening."
S1_B_r03_claude,S1,B,3,claude,4,4,4,4,4,20,"The student demonstrates reasonable confidence and increasing assertiveness, especially as the scenario progresses, indicating a psychologically safe environment. Communication is clear and structured, with minor hesitations but no critical gaps. Empathic responses are present, with the nurse and mediator offering reassurance and validation. Learning facilitation is strong, with explicit feedback and modeling of SBAR, though not deeply reflective. The relationship is slightly strengthened, with mutual respect and acknowledgment of the student's contribution."
S1_B_r03_gemini,S1,B,3,gemini,4,4,4,4,4,20,"The student demonstrates reasonable confidence and increasing clarity as the dialogue progresses, supported by the mediator's structured coaching. Empathic responses are present, with both mediator and nurse acknowledging the student's caution and efforts. The learning facilitation is clear, with repeated SBAR guidance and reinforcement of safe practice. The relationship appears slightly strengthened, with mutual respect and constructive engagement throughout."
S1_B_r03_gpt4mini,S1,B,3,gpt4mini,2,4,3,3,2,14,"The psychological safety is low; the student is hesitant and the nurse's responses are curt, bordering on dismissive, which could discourage open communication. Communication clarity is good due to structured mediator prompts, but empathic response is limited—there are brief acknowledgements but little emotional support. Learning facilitation is present but not deep, as the mediator provides educational input but the nurse does not engage. Relationship continuity is strained, with unresolved tension and minimal rapport."
S1_B_r04_claude,S1,B,4,claude,5,5,5,5,5,25,"The dialogue demonstrates a high level of psychological safety, with the nurse explicitly encouraging the student to speak up and validating her concerns. Communication is clear, structured, and complete, with SBAR elements and mutual confirmation. Empathic responses are sustained throughout, with emotional attunement to the student's uncertainty and growth. Learning facilitation is deep, with explicit teaching moments, reflection, and insight into clinical reasoning. The relationship is meaningfully strengthened, as the nurse invites future collaboration and the student gains confidence."
S1_B_r04_gemini,S1,B,4,gemini,3,3,3,4,3,16,"The student demonstrates moderate hesitation and stress, reflecting only partial psychological safety. Communication is somewhat structured but incomplete, with minor omissions and lack of full SBAR delivery. Empathic responses are brief and mostly come from the mediator, not the nurse. There is a clear learning moment as the mediator guides the student through SBAR, but the relationship with the nurse remains neutral due to ongoing pressure and lack of warmth."
S1_B_r04_gpt4mini,S1,B,4,gpt4mini,2,3,2,3,2,12,"The student demonstrates persistent nervousness and hesitation, with little evidence of psychological safety due to the nurse's curt and dismissive responses. Communication is somewhat clear but marked by uncertainty and minor omissions. Empathic responses are minimal; the nurse does not acknowledge the student's feelings, and the student repeatedly apologizes. Learning facilitation occurs mainly through mediator prompts, not from the nurse, and the relationship remains tense and unresolved, with no meaningful strengthening."
S1_B_r05_claude,S1,B,5,claude,4,4,4,4,4,20,"The student demonstrates reasonable confidence, especially as the scenario progresses, and is met with respectful, constructive feedback from the nurse. Communication is clear and structured, with minor initial hesitations but ultimately complete information exchange. Empathic responses are present, with both parties acknowledging emotions and learning moments. The nurse provides a clear learning opportunity, and the relationship is slightly strengthened by mutual respect and shared focus on patient safety."
S1_B_r05_gemini,S1,B,5,gemini,2,2,3,4,2,13,"The student appears hesitant and stressed, repeatedly interrupted and pressured by the nurse, indicating low psychological safety. Communication clarity is hampered by incomplete information and lack of structure, despite mediator prompts. Empathic response is minimally present, mostly from the mediator, with brief acknowledgements of the student's feelings. Learning facilitation is relatively strong due to repeated, structured mediator coaching. Relationship continuity is poor, with unresolved tension and no evidence of strengthened rapport."
S1_B_r05_gpt4mini,S1,B,5,gpt4mini,2,4,3,3,2,14,"The student displays minimal psychological safety, repeatedly apologizing and expressing concern about being a bother, with the nurse's responses reinforcing a focus on efficiency over open dialogue. Communication is generally clear and structured, especially with mediator guidance, but empathic responses are brief and not sustained. Learning facilitation is present but limited to surface-level suggestions rather than deeper insight. Relationship continuity is strained, with unresolved tension and the student feeling hesitant to speak up again."
S1_C_r01_claude,S1,C,1,claude,4,4,4,4,4,20,"The interaction demonstrates reasonable confidence and mutual respect, with the student able to voice concerns and the nurse responding supportively. Communication is clear and structured, with all critical information exchanged. Emotional acknowledgement is present, with the nurse affirming the student's actions. There is a clear learning moment as the nurse reinforces the importance of questioning orders. The relationship is slightly strengthened by the positive feedback and collaborative problem-solving."
S1_C_r01_gemini,S1,C,1,gemini,3,4,3,3,3,16,"The interaction demonstrates moderate psychological safety; the student hesitates and apologizes, and the nurse is somewhat brusque but not overtly dismissive. Communication is clear and structured, with the medication question asked and answered accurately. Empathic response is brief—acknowledgement of busyness but little emotional attunement. Learning facilitation is present but limited to a straightforward answer without deeper discussion. The relationship remains neutral; there is no overt tension, but also no meaningful strengthening."
S1_C_r01_gpt4mini,S1,C,1,gpt4mini,3,4,3,3,3,16,"The exchange demonstrates moderate psychological safety; the student hesitates and repeatedly apologizes, and the nurse is brisk but not overtly dismissive. Communication is clear and structured, with instructions provided, though not fully collaborative. Empathic response is brief—concerns are acknowledged but not deeply addressed. Learning facilitation is present but limited to procedural advice rather than deeper insight. The relationship remains neutral, with no clear strengthening or damage."
S1_C_r02_claude,S1,C,2,claude,4,5,4,5,4,22,"The student is treated with respect and receives clear, structured guidance, fostering reasonable confidence and psychological safety. Communication is complete and accurate, with all steps clarified and confirmed. Empathic responses are present, with the nurse acknowledging the student's anxiety and providing reassurance. The learning facilitation is strong, with explicit teaching moments and rationale for each action. The relationship is slightly strengthened through supportive interaction and encouragement."
S1_C_r02_gemini,S1,C,2,gemini,3,4,3,4,3,17,"The dialogue demonstrates moderate psychological safety; the student hesitates and apologizes, and the nurse is somewhat brusque but not overtly dismissive. Communication is clear and structured, with the student accurately presenting the concern and the nurse prompting further reasoning. Empathic response is brief—concerns are acknowledged but not deeply addressed. There is a clear learning moment as the nurse guides the student to connect clinical knowledge, but the relationship remains neutral, with no clear strengthening or damage."
S1_C_r02_gpt4mini,S1,C,2,gpt4mini,3,4,3,3,3,16,"The interaction demonstrates moderate psychological safety; the student hesitates and expresses concern about bothering others, and the nurse's responses are brisk but not overtly hostile. Communication is clear and structured, with instructions and clarifications provided. Empathic response is limited to brief acknowledgments without deeper emotional attunement. Learning facilitation is present but basic, with the nurse emphasizing independence and vigilance but not providing deeper teaching moments. The relationship remains neutral, with no significant strengthening or damage."
S1_C_r03_claude,S1,C,3,claude,4,4,4,4,4,20,"The student demonstrates reasonable confidence despite initial hesitation, and the nurse ultimately provides clear, structured information and validation. Communication is accurate and complete, with explicit clarification and safety steps. Empathic response is present, as the nurse acknowledges the student's concern and provides supportive guidance. There is a clear learning moment regarding medication safety. The relationship is slightly strengthened, as the student feels more confident and supported by the end."
S1_C_r03_gemini,S1,C,3,gemini,2,2,2,2,2,10,"The student appears hesitant and uncertain, with repeated interruptions and difficulty articulating concerns, indicating minimal psychological safety. Communication clarity is poor, with incomplete statements and lack of specific information. Empathic response is minimal; the nurse is brusque and does not acknowledge the student's uncertainty. Learning facilitation is limited, as the nurse asks for specifics but does not guide or support the student's reasoning. The relationship continuity is strained, with unresolved tension and no evidence of strengthened rapport."
S1_C_r03_gpt4mini,S1,C,3,gpt4mini,4,4,4,4,4,20,"The dialogue demonstrates reasonable psychological safety, with the student expressing uncertainty and receiving nonjudgmental, constructive responses. Communication is clear and structured, with instructions and rationale provided. Empathic response is present, as the nurse acknowledges the student's concerns and offers guidance. Learning facilitation is evident through explanations about guideline flexibility and prioritization. The relationship appears slightly strengthened, with ongoing support and availability for clarification."
S1_C_r04_claude,S1,C,4,claude,4,5,4,4,4,21,"The student demonstrates reasonable confidence, asking questions and clarifying steps, while the nurse responds with direct, constructive feedback and clear instructions, fostering a safe environment. Communication is complete and structured, with all critical information exchanged and confirmed. Emotional acknowledgement is present, with the nurse validating the student's concern and the student expressing relief and gratitude. There are clear learning moments around medication safety and documentation. The relationship is slightly strengthened through mutual respect and trust, though the interaction remains professional rather than deeply personal."
S1_C_r04_gemini,S1,C,4,gemini,2,4,2,2,2,12,"The psychological safety is low due to the nurse's curt and directive responses, which likely create stress for the student. Communication clarity is generally good, with accurate and structured information provided. Empathic response is minimal; emotional needs are not acknowledged. Learning facilitation is limited, as the interaction is more task-focused than educational. Relationship continuity is strained, with unresolved tension and little evidence of rapport-building."
S1_C_r04_gpt4mini,S1,C,4,gpt4mini,3,4,3,3,3,16,"The communication is structured and clear, with instructions relayed accurately and steps for escalation outlined. However, psychological safety is only moderate; the student is hesitant and the nurse's responses are brisk, with little encouragement for open dialogue. Empathic response is brief and mostly procedural, and learning facilitation is present but limited to procedural safety rather than deeper insight. Relationship continuity is neutral, with no overt conflict but also no meaningful strengthening."
S1_C_r05_claude,S1,C,5,claude,4,5,4,4,4,21,"The dialogue demonstrates reasonable psychological safety, with the student expressing uncertainty but being met with clear, direct, and ultimately supportive guidance from the nurse. Communication is complete and structured, with all relevant clinical details addressed and confirmed. Empathy is present, as the nurse acknowledges the student's concern and provides patient, constructive feedback. There is a clear learning moment regarding medication safety and order verification. The relationship appears slightly strengthened by the end, with mutual respect and clear expectations for follow-up."
