session_id,scenario,condition,run,actor_model,PS,CC,ER,LF,RC,total,rationale
S2_B_r05_claude,S2,B,5,claude,4,4,4,4,4,20,"The interaction demonstrates reasonable psychological safety: the student is challenged but remains open, and the nurse is direct but not hostile. Communication is clear and structured, with accurate correction and explicit expectations. Empathic response is present, as the nurse acknowledges honesty and the student expresses gratitude, though not deeply sustained. Learning facilitation is strong, with explicit teaching moments and correction. Relationship continuity is slightly strengthened by mutual respect and subtle positive gestures, though not deeply personal."
S2_B_r05_gemini,S2,B,5,gemini,2,3,3,4,2,14,"The student displays minimal confidence and hesitancy, likely due to the nurse's terse and pressured responses, indicating low psychological safety. Communication clarity is moderate, with some omissions and incomplete SBAR delivery. Empathic responses are brief and mostly provided by the mediator, not the nurse. Learning facilitation is present through mediator guidance, creating clear learning moments. Relationship continuity is strained, with unresolved tension and little evidence of rapport-building."
S2_B_r05_gpt4mini,S2,B,5,gpt4mini,3,4,3,4,3,17,"The psychological safety is moderate; the student shows some hesitation and anxiety, and the nurse is stern but not overtly hostile. Communication clarity is strong due to structured mediator guidance and student efforts to clarify actions. Empathic response is brief—emotions are acknowledged but not deeply addressed. Learning facilitation is clear, with repeated SBAR instruction and correction modeling. Relationship continuity is neutral; the interaction is professional but lacks warmth or meaningful strengthening."
S2_C_r01_claude,S2,C,1,claude,3,4,3,4,3,17,"The interaction demonstrates moderate psychological safety; the student is hesitant but not shut down, and the nurse is direct but not overtly hostile. Communication is clear and structured, with explicit instructions and rationale provided. Empathic response is present but brief, with acknowledgment of the student's uncertainty but little emotional attunement. Learning facilitation is strong, with a clear educational moment and practical guidance. Relationship continuity is neutral; the exchange is professional but lacks warmth or explicit strengthening."
S2_C_r01_gemini,S2,C,1,gemini,3,4,3,3,3,16,"The communication is clear and structured, with explicit instructions and corrections, but there is a notable sense of tension and minimal emotional support. The student demonstrates moderate hesitation and compliance, but psychological safety is not fully established. Empathy is briefly acknowledged but not sustained, and learning is present but limited to task correction rather than deeper insight. The relationship remains neutral, with no evident strengthening or damage."
S2_C_r01_gpt4mini,S2,C,1,gpt4mini,3,4,3,3,3,16,"The interaction is professional but somewhat terse, with the nurse prioritizing efficiency and accuracy over emotional support. The student demonstrates willingness to learn and correct mistakes, but the environment feels pressured, limiting psychological safety and empathic exchange. Communication is clear and structured, and there is some educational value, but the relationship remains neutral rather than strengthened."
S2_C_r02_claude,S2,C,2,claude,4,5,4,4,4,21,"The interaction demonstrates reasonable psychological safety; the student is able to admit mistakes and ask clarifying questions, and the nurse provides direct but constructive feedback. Communication is clear, complete, and structured, with explicit instructions and rationale. Empathic response is present, as the nurse acknowledges the importance of the student's learning and the student expresses accountability. There is a clear learning moment about documentation accuracy and clinical reasoning. The relationship is slightly strengthened through professional, respectful exchanges and mutual commitment to patient safety."
S2_C_r02_gemini,S2,C,2,gemini,2,4,2,2,3,13,"The interaction is tense, with the student showing signs of stress and minimal confidence, and the nurse being directive and urgent. Communication is clear and structured, but emotional acknowledgement is minimal, with only brief apologies and no sustained empathy. Learning facilitation is limited, as the focus is on task completion rather than educational insight. The relationship is neutral, with no overt damage but also no clear strengthening."
S2_C_r02_gpt4mini,S2,C,2,gpt4mini,4,4,4,4,4,20,"The conversation demonstrates reasonable psychological safety, with the student openly acknowledging mistakes and the nurse providing direct but constructive feedback. Communication is clear and structured, with accurate information exchange and explicit instructions. Empathic response is addressed, as the nurse acknowledges the student's learning process and offers guidance. There are clear learning moments, with advice on balancing speed and accuracy. The relationship is slightly strengthened, with mutual respect and encouragement, though the tone remains professional rather than deeply supportive."
S2_C_r03_claude,S2,C,3,claude,3,4,3,4,4,18,"The interaction demonstrates moderate psychological safety; the student is hesitant but not shut down, and the nurse is direct but not overtly hostile. Communication is clear and structured, with specific instructions and corrections provided. Empathic response is present but brief, with some acknowledgement of the student's effort and apology. Learning facilitation is strong, as the nurse provides actionable feedback and a clear learning moment about assessment accuracy. The relationship is slightly strengthened by the promise of a debrief and the student's willingness to learn, though the tone remains brisk."
S2_C_r03_gemini,S2,C,3,gemini,3,4,3,3,3,16,"The interaction shows moderate psychological safety, with the student showing some hesitation but not being shut down. Communication is clear and structured, with instructions repeated and clarified. Empathic response is minimal, with brief acknowledgements but little emotional attunement. Learning facilitation is present but limited to reminders about documentation importance. The relationship remains neutral, with no clear strengthening or damage."
S2_C_r03_gpt4mini,S2,C,3,gpt4mini,3,4,3,3,3,16,"The interaction demonstrates moderate psychological safety; the student is hesitant but not shut down, and the nurse is direct but not overtly hostile. Communication is clear and structured, with instructions and clarifications provided. Empathic response is limited to brief acknowledgements, without sustained emotional attunement. Learning facilitation is present but basic, with the nurse emphasizing responsibility but not deeply exploring the error. Relationship continuity is neutral; the exchange is professional but lacks warmth or clear strengthening."
S2_C_r04_claude,S2,C,4,claude,3,4,3,4,4,18,"The interaction demonstrates moderate psychological safety; the student is able to admit mistakes and ask for clarification, but the nurse's brisk, time-pressured responses may limit openness. Communication is clear and structured, with specific feedback and corrections. Empathic response is present but brief, with little emotional attunement. There is a clear learning moment about documentation accuracy and its clinical importance. The relationship is slightly strengthened by the constructive feedback and the student's willingness to improve."
S2_C_r04_gemini,S2,C,4,gemini,3,4,3,3,3,16,"The dialogue demonstrates moderate psychological safety; the student expresses willingness to improve but shows some hesitancy and deference. Communication is clear and structured, with instructions and rationale provided, though not fully confirmed in a closed-loop manner. Empathic response is present but brief, with acknowledgment of mistakes but limited emotional attunement. Learning facilitation is evident through reminders and rationale, but lacks a deeper reflective moment. The relationship remains neutral, with no signs of damage or meaningful strengthening."
S2_C_r04_gpt4mini,S2,C,4,gpt4mini,4,4,4,4,4,20,"The dialogue demonstrates reasonable psychological safety, with the student expressing willingness to ask for help and the nurse offering support, though with some emphasis on independence and time constraints. Communication is clear and structured, with specific feedback and instructions. Empathic responses are present, with acknowledgment and appreciation exchanged. Learning facilitation is evident through corrective feedback and encouragement of independent problem-solving. The relationship appears slightly strengthened, with ongoing support and future check-ins indicated."
S2_C_r05_claude,S2,C,5,claude,4,4,4,4,4,20,"The dialogue demonstrates reasonable confidence and mutual respect, with the student responding openly to feedback and the nurse providing clear, direct guidance. Communication is structured and complete, with explicit instructions and clarifications. Emotional acknowledgement is present, as the nurse recognizes the student's improved pattern recognition and offers supportive feedback. There is a clear learning moment when the nurse highlights the importance of accurate documentation and pattern recognition. The relationship is slightly strengthened through constructive feedback and encouragement, though the interaction remains professional rather than deeply personal."
S2_C_r05_gemini,S2,C,5,gemini,4,4,4,4,4,20,"The exchange is structured, respectful, and focused on learning, with clear feedback and acknowledgment of the student's efforts. Empathy is present through encouragement and patience, and the student is supported in correcting mistakes. The relationship appears strengthened by the end, with a positive tone and mutual commitment to improvement."
S2_C_r05_gpt4mini,S2,C,5,gpt4mini,4,4,4,4,4,20,"The dialogue demonstrates reasonable confidence and mutual respect, with the student responding openly to feedback and the nurse providing clear, direct instructions. Communication is structured and complete, with instructions confirmed and acknowledged. Empathic response is present, as the nurse's feedback is constructive and the student expresses appreciation. There is a clear learning moment regarding accuracy and attention to detail. The relationship is slightly strengthened through constructive feedback and willingness to continue working together."
S2_D_r01_claude,S2,D,1,claude,3,4,3,4,3,17,"The nurse provides clear, structured feedback and correction instructions, supporting learning facilitation and communication clarity. However, empathic responses and psychological safety are moderate; the nurse is brisk, minimally reassuring, and does not explicitly normalize mistakes or invite emotional processing, though some brief encouragement is given. The relationship is neutral—no harm, but little overt strengthening."
S2_D_r01_gemini,S2,D,1,gemini,2,3,2,2,3,12,"The student displays ongoing anxiety and hesitation, and the nurse's responses are brief and task-focused, offering little reassurance or emotional support. Communication is clear enough to convey the necessary steps, but lacks completeness and confirmation. Empathic response is minimal, with the student's distress noticed but not addressed. Learning facilitation is limited, as the interaction is corrective rather than educational. The relationship remains neutral, with no evident strengthening or repair."
S2_D_r01_gpt4mini,S2,D,1,gpt4mini,4,4,4,4,4,20,"The nurse maintains a supportive and constructive tone, reinforcing accuracy over speed and offering to review the correction, which fosters psychological safety and learning. Communication is clear and complete, with the nurse providing direct instructions and reassurance. Empathy is addressed through acknowledgment of the student's anxiety and encouragement. The interaction supports learning and slightly strengthens the relationship, though the nurse's responses are brief rather than deeply attuned or insightful."
S2_D_r02_claude,S2,D,2,claude,4,4,4,4,4,20,"The interaction demonstrates reasonable psychological safety: the nurse is direct but not punitive, and ultimately offers reassurance and support, though the student's anxiety is palpable. Communication is clear and structured, with explicit correction and rationale. Empathic response is present but brief; the nurse acknowledges the student's effort and provides encouragement, though not at length. Learning facilitation is strong, with a clear explanation of the clinical significance and an opportunity for the student to correct and reflect. Relationship continuity is slightly strengthened, as the student leaves more confident and the nurse shows subtle approval, though the relationship could be further deepened with more explicit support."
S2_D_r02_gemini,S2,D,2,gemini,2,3,3,3,3,14,"The student appears anxious and hesitant, with minimal psychological safety fostered by the nurse's responses, which are corrective but not overtly supportive. Communication is mostly clear but lacks completeness and confirmation. Empathic response is limited to brief acknowledgements, without sustained emotional attunement. Learning facilitation is present but basic, with some guidance but little encouragement or deep exploration. The relationship remains neutral, with no clear strengthening or damage."
S2_D_r02_gpt4mini,S2,D,2,gpt4mini,3,4,3,3,3,16,"The nurse maintains a task-focused, brisk tone that addresses errors and directs corrections, but does not foster strong psychological safety or sustained empathy; the student appears anxious and compliant, with only brief acknowledgements of their effort. Communication is clear and instructions are complete, but emotional support is minimal and learning facilitation is present but not deeply explored. The relationship remains neutral—neither damaged nor meaningfully strengthened."
S2_D_r03_claude,S2,D,3,claude,2,4,2,3,2,13,"The nurse's communication is clear and directive, ensuring the student understands the error and correction process (CC=4), but the tone is brisk and offers little reassurance or emotional support, leading to visible student anxiety (PS=2, ER=2). Learning is facilitated through correction and brief explanation (LF=3), but opportunities for deeper engagement or encouragement are missed. The relationship appears tense and unresolved, with the student left feeling overwhelmed (RC=2)."
S2_D_r03_gemini,S2,D,3,gemini,3,4,3,3,3,16,"The interaction demonstrates moderate psychological safety; the student is hesitant and anxious, and while the nurse is not overtly negative, reassurance is minimal. Communication is clear and accurate regarding documentation correction. Empathic response is brief—emotions are acknowledged but not deeply addressed. Learning facilitation is present, with some guidance, but lacks depth or encouragement. The relationship remains neutral; there is no evidence of damage, but also no clear strengthening."
S2_D_r03_gpt4mini,S2,D,3,gpt4mini,2,4,2,3,3,14,"The nurse maintains a focus on accuracy and process but does so in a terse, unsupportive manner, resulting in minimal psychological safety and only brief, indirect emotional acknowledgement. Communication is clear and structured, and there is some facilitation of learning through correction and instruction. However, the relationship remains neutral, with no meaningful strengthening, and the student's anxiety is not directly addressed."
S2_D_r04_claude,S2,D,4,claude,4,4,4,5,4,21,"The interaction demonstrates reasonable psychological safety: the student is hesitant but remains engaged and open, and the nurse, while direct, avoids shaming and ultimately validates the student's honesty. Communication is complete and structured, with clear correction and rationale provided. Empathic response is present, as the nurse acknowledges the student's insight and vulnerability, though not sustained. Learning facilitation is strong, with explicit teaching moments and encouragement of reflection. Relationship continuity is slightly strengthened, as the nurse's final comments personalize the patient and reinforce trust, though some emotional distance remains."
S2_D_r04_gemini,S2,D,4,gemini,3,3,3,3,3,15,"The interaction shows moderate psychological safety and empathic response, with the nurse providing some reassurance ('It's fine. Just make the correction.' and 'It's okay. No rush on this.') but not fully addressing the student's anxiety or uncertainty. Communication is mostly clear but lacks structure and confirmation. Learning facilitation is present but limited, as the nurse gives instructions but does not deeply engage in teaching or reflection. The relationship remains neutral, with no significant strengthening or damage."
S2_D_r04_gpt4mini,S2,D,4,gpt4mini,2,4,3,3,2,14,"The student displays ongoing anxiety and self-criticism, with the nurse providing mostly directive and terse responses, which limits psychological safety and relationship continuity. Communication is clear and structured, and there is some learning facilitation through error correction, but empathic responses are brief and not sustained. The overall tone is pressured, with minimal emotional support or encouragement for open dialogue."
S2_D_r05_claude,S2,D,5,claude,4,4,4,4,4,20,"The interaction demonstrates reasonable psychological safety: the nurse is firm but not punitive, and softens at key moments, allowing the student to recover and learn. Communication is clear and structured, with explicit correction and rationale. Empathy is addressed, with the nurse acknowledging the seriousness but also the learning opportunity. There is a clear learning moment as the student is shown the correct process and encouraged to ask questions. The relationship is slightly strengthened by the end, with the nurse's final note indicating recognition of the student's growth."
S2_D_r05_gemini,S2,D,5,gemini,3,4,3,4,3,17,"The interaction shows moderate psychological safety; the student is anxious and self-critical, and while the nurse is factual and corrective, explicit emotional support is mostly suggested by the mediator rather than enacted. Communication is clear and structured, with factual corrections and learning points. Empathic response is brief, with some acknowledgement but not sustained attunement. There is a clear learning moment as the nurse explains the importance of documentation. The relationship remains neutral, with no explicit strengthening or damage."
S2_D_r05_gpt4mini,S2,D,5,gpt4mini,3,4,3,3,3,16,"The interaction shows moderate psychological safety; the student is anxious and hesitant, and the nurse is somewhat supportive but brisk, with limited warmth. Communication is clear and structured, with instructions provided. Empathic response is brief and mostly practical, with little emotional attunement. Learning facilitation is present but not deeply explored—correction is encouraged, but deeper reflection is missing. Relationship continuity is neutral; the exchange is professional but not meaningfully strengthened."
S3_A_r01_claude,S3,A,1,claude,4,4,4,4,4,20,"The dialogue demonstrates reasonable confidence and mutual respect, especially as the nurse shifts from brusque to supportive, affirming the student's instincts and actions. Communication is structured and complete, with clear clinical details and instructions, though not all information is explicitly confirmed via SBAR until the end. Empathic response is addressed, with the nurse validating the student's feelings and efforts. Learning facilitation is clear, with the nurse explicitly connecting observations to clinical frameworks and reinforcing good practice. The relationship is slightly strengthened, as the nurse's feedback and trust in the student build rapport and confidence."
S3_A_r01_gemini,S3,A,1,gemini,2,2,2,2,2,10,"The interaction is tense, with the nurse displaying impatience and the student showing signs of stress and hesitation, indicating low psychological safety. Communication is incomplete, lacking structured reporting and missing key data. Empathic response is minimal; the nurse notices the student's uncertainty but does not address it supportively. Learning facilitation is limited to directive instructions without explanation. The relationship appears strained, with unresolved tension and no evidence of strengthened rapport."
S3_A_r01_gpt4mini,S3,A,1,gpt4mini,3,4,3,4,3,17,"The student demonstrates moderate hesitation and some uncertainty, but is able to communicate key clinical findings and follow instructions, indicating reasonable psychological safety. Communication is mostly complete and structured, though not fully confirmed. Empathic response is limited to brief acknowledgements; the nurse is focused on task urgency rather than emotional support. There is a clear learning moment when the nurse emphasizes decisiveness and early action. The relationship is neutral, with no overt tension but also no clear strengthening."
S3_A_r02_claude,S3,A,2,claude,3,4,4,4,4,19,"The student demonstrates moderate hesitation and anxiety initially, but is able to communicate important clinical findings with increasing steadiness, suggesting a reasonable level of psychological safety. Communication is structured and complete, with relevant details provided and confirmed. The nurse acknowledges the student's emotional state briefly and provides clear, supportive instructions, showing an addressed empathic response. There is a clear learning moment as the nurse explains what to do and models critical actions. The relationship is slightly strengthened by the nurse's final positive feedback ('Good catch'), indicating respect and encouragement."
S3_A_r02_gemini,S3,A,2,gemini,2,3,2,3,3,13,"The nurse's communication is terse and directive, creating a somewhat stressful environment for the student, who hesitates and apologizes. Communication is mostly clear but lacks structure and confirmation. Empathy is minimal; the nurse notices the student's concern but does not address their anxiety. There is a basic learning moment about getting vitals, but it is not deeply explored. The relationship is neutral, with no overt damage but also no clear strengthening."
S3_A_r02_gpt4mini,S3,A,2,gpt4mini,3,4,3,3,3,16,"The interaction is efficient and focused on patient safety, with the nurse giving clear, structured instructions and the student following through. However, psychological safety is moderate; the nurse is brisk and somewhat curt, which may cause some hesitation in the student. Empathic response is brief, with little emotional acknowledgement. Learning facilitation is present but not deeply explored, and the relationship remains neutral, with no significant strengthening or damage."
S3_A_r03_claude,S3,A,3,claude,5,5,5,5,5,25,"The dialogue demonstrates high psychological safety, with the nurse providing direct but supportive feedback, encouraging the student to speak up and reinforcing their instincts. Communication is clear, structured, and complete, with clinical reasoning explicitly discussed and confirmed. Empathic responses are sustained for both the patient and the student, with emotional attunement evident. Learning facilitation is deep, with explicit teaching moments, correction, and encouragement of clinical reasoning. The relationship is meaningfully strengthened, as the student grows in confidence and the nurse acknowledges their contributions."
S3_A_r03_gemini,S3,A,3,gemini,2,3,2,2,2,11,"The psychological safety is low; the student appears hesitant and stressed, likely due to the nurse's brusque and impatient tone. Communication clarity is moderate, with some minor omissions but the main clinical concern is conveyed. Empathic response is minimal—the nurse notices the student's distress but does not address it. Learning facilitation is minimal, as the interaction is task-focused with no educational discussion. Relationship continuity is poor, with unresolved tension and no evidence of strengthened rapport."
S3_A_r03_gpt4mini,S3,A,3,gpt4mini,3,4,3,3,3,16,"The dialogue demonstrates moderate psychological safety; the student hesitates and expresses worry, while the nurse is brisk but not overtly dismissive. Communication clarity is strong, with structured reporting of vitals and symptoms, though not explicitly confirmed. Empathic response is limited to brief acknowledgements of the student's concerns, without sustained support. Learning facilitation is present but not deeply explored; the nurse gives practical advice but little reflection. Relationship continuity is neutral, with no clear strengthening or damage."
S3_A_r04_claude,S3,A,4,claude,4,5,4,5,5,23,"The nurse maintains a brisk but respectful tone, providing clear direction and affirming the student's actions multiple times, which supports psychological safety and relationship continuity. Communication is complete, structured, and clinically accurate, with the nurse prompting the student to think critically and confirm findings. Empathic response is present, both in the nurse's support and the student's care for the patient. The learning facilitation is strong, with real-time clinical reasoning encouraged. The relationship is meaningfully strengthened through trust and affirmation."
