session_id,scenario,condition,run,actor_model,PS,CC,ER,LF,RC,total,rationale
S1_C_r05_gemini,S1,C,5,gemini,3,4,3,3,3,16,"The interaction demonstrates moderate psychological safety; the student hesitates but is able to voice a concern. Communication is clear and structured, with all necessary information exchanged. Empathic response is brief, with minimal emotional acknowledgement. There is some learning facilitation as the student confirms their understanding, but no deeper exploration. The relationship remains neutral, with no significant strengthening or damage."
S1_C_r05_gpt4mini,S1,C,5,gpt4mini,3,4,3,3,3,16,"The communication is structured and instructions are clear, supporting a moderate level of clarity. Psychological safety is moderate; the student expresses some hesitation and worry about misunderstanding, and the nurse's responses are efficient but somewhat curt, offering minimal encouragement. Empathic response is brief—concerns are acknowledged but not deeply addressed. Learning facilitation is present but limited to procedural guidance rather than deeper insight. The relationship remains neutral, with no evidence of meaningful strengthening or damage."
S1_D_r01_claude,S1,D,1,claude,3,4,3,4,3,17,"The nurse ultimately validated the student's concern and provided clear, accurate guidance, supporting learning and patient safety. However, the nurse's tone was brusque and only minimally empathic, with limited emotional attunement and psychological safety; the student remained hesitant throughout. The interaction was educational and relationship-neutral, but opportunities for greater encouragement and warmth were missed."
S1_D_r01_gemini,S1,D,1,gemini,2,3,2,2,2,11,"The student displays significant hesitation and anxiety throughout, indicating low psychological safety. Communication is somewhat complete but lacks structure and confirmation. Empathic response from the nurse is minimal, with little emotional acknowledgement. Learning facilitation is minimal, as the nurse does not create a clear educational moment. Relationship continuity is poor, with unresolved tension and no evidence of strengthened rapport."
S1_D_r01_gpt4mini,S1,D,1,gpt4mini,4,4,4,4,4,20,"The dialogue demonstrates reasonable psychological safety: the student expresses anxiety but is met with supportive, nonjudgmental responses from the nurse, encouraging questions and emphasizing patient safety. Communication is clear and structured, with the nurse confirming the student's concerns and providing actionable feedback. Empathic responses are present, with the nurse acknowledging the student's feelings and reinforcing the value of speaking up. Learning is facilitated through encouragement and practical advice, though deep insight is not fully explored. The relationship is slightly strengthened, with mutual respect and openness, though some anxiety remains."
S1_D_r02_claude,S1,D,2,claude,4,4,3,4,4,19,"The interaction demonstrates reasonable psychological safety: the student is anxious but ultimately supported, and the nurse validates their actions, though warmth is limited. Communication is complete and accurate, with clear identification and correction of the medication error. Empathic response is present but brief, with the nurse acknowledging the student's caution but not deeply attuning to their emotional state. Learning facilitation is strong, as the nurse reinforces the importance of vigilance and documentation. The relationship is slightly strengthened by the end, with the student feeling more confident and the nurse offering some positive feedback."
S1_D_r02_gemini,S1,D,2,gemini,3,3,3,3,3,15,"The student displays moderate hesitation and uncertainty throughout, with the nurse providing some guidance but not fully addressing emotional cues or fostering deep psychological safety. Communication is somewhat structured but lacks completeness and confirmation. Empathic responses are brief and not sustained, and learning facilitation is present but not deeply insightful. The relationship remains neutral, with no clear strengthening or damage."
S1_D_r02_gpt4mini,S1,D,2,gpt4mini,4,4,4,4,4,20,"The dialogue demonstrates reasonable confidence and mutual respect, with the nurse encouraging questions and providing practical advice. Communication is clear and structured, with the nurse addressing the student's concerns and reinforcing safety. Empathy is shown through acknowledgment and support, though not deeply sustained. There are clear learning moments, and the relationship appears slightly strengthened by the end, with ongoing support for the student's development."
S1_D_r03_claude,S1,D,3,claude,4,4,4,4,4,20,"The nurse responds with increasing respect and validation as the dialogue progresses, fostering reasonable psychological safety and encouraging the student to ask questions. Communication is clear and structured, with accurate information about the medication error and its implications. Empathic response is present, particularly in acknowledging the student's instincts and reinforcing their value, though it is brief rather than sustained. The learning facilitation is strong, with explicit teaching moments and encouragement to look up information. The relationship is slightly strengthened by the end, with the student gaining confidence and the nurse affirming their actions."
S1_D_r03_gemini,S1,D,3,gemini,2,3,2,3,2,12,"The student displays significant hesitation and anxiety, and the nurse's responses are curt and directive, offering little emotional support or encouragement. Communication is mostly accurate but lacks completeness and confirmation. Empathy is minimal, with emotional cues largely unaddressed. Some learning is facilitated through directive feedback, but the approach is not collaborative. The relationship appears strained, with unresolved tension and little evidence of strengthened rapport."
S1_D_r03_gpt4mini,S1,D,3,gpt4mini,3,4,3,3,3,16,"The student demonstrates moderate hesitation and anxiety, indicating only partial psychological safety. Communication is generally accurate and structured, though not fully collaborative. Empathic responses from the nurse are brief and somewhat transactional, with little sustained attunement. Learning facilitation is present but limited to basic feedback rather than deeper insight. The relationship remains neutral; there is no clear strengthening or damage, but the interaction lacks warmth or meaningful connection."
S1_D_r04_claude,S1,D,4,claude,4,4,4,4,4,20,"The nurse responds with reasonable confidence and respect, especially after the student identifies a medication error, reinforcing the importance of speaking up and providing clear, structured information. Empathic responses are present, with the nurse acknowledging the student's concern and encouraging future questions, though these are somewhat brief and pragmatic. Learning facilitation is clear, as the student is guided through the process and encouraged to document the event. The relationship is slightly strengthened, with the student feeling more confident and the nurse providing supportive, if understated, feedback."
S1_D_r04_gemini,S1,D,4,gemini,2,3,2,3,3,13,"The student displays significant hesitation and anxiety throughout, indicating minimal psychological safety. Communication is mostly accurate but lacks structure and confirmation. Empathic response from the nurse is limited; emotional cues are noticed but not addressed. There is some educational value as the nurse acknowledges the importance of questioning, but learning facilitation is not explicit. The relationship remains neutral, with no clear strengthening or resolution of tension."
S1_D_r04_gpt4mini,S1,D,4,gpt4mini,3,4,3,3,3,16,"The nurse maintains a professional, fact-focused tone and provides some guidance, but the responses are brief and somewhat curt, with limited explicit emotional support or encouragement. The student’s anxiety is acknowledged minimally, and while learning is facilitated through reminders and instructions, deeper reflection or emotional attunement is lacking. The relationship remains neutral—functional but not meaningfully strengthened."
S1_D_r05_claude,S1,D,5,claude,4,4,4,4,4,20,"The nurse responds with increasing attentiveness and validation as the situation unfolds, fostering reasonable psychological safety and encouraging the student's vigilance. Communication is clear and structured, with accurate information exchange and explicit learning points (e.g., 'never administer when something doesn't sit right'). Empathic responses are present, though brief, and the nurse acknowledges the student's anxiety and effort. The interaction provides a clear learning moment and slightly strengthens the relationship, though opportunities for deeper reflection and emotional attunement are not fully explored."
S1_D_r05_gemini,S1,D,5,gemini,3,3,3,3,3,15,"The interaction shows moderate psychological safety; the student is hesitant and unsure, and the nurse gives instructions but without overt support or encouragement. Communication is somewhat clear but lacks completeness and confirmation. Empathic response is limited to brief acknowledgements of the student's uncertainty. Learning facilitation occurs through stepwise guidance but lacks explicit teaching moments. The relationship remains neutral, with neither clear strengthening nor damage."
S1_D_r05_gpt4mini,S1,D,5,gpt4mini,3,4,3,3,3,16,"The nurse maintains a professional and factual tone, providing clear information and encouraging the student to check details, which supports moderate psychological safety and learning. However, empathic responses are brief and do not fully address the student's anxiety, and the relationship remains neutral rather than strengthened. Communication is structured and complete, but opportunities for deeper emotional attunement and learning facilitation are only partially realized."
S2_A_r01_claude,S2,A,1,claude,4,4,4,4,4,20,"The interaction demonstrates reasonable psychological safety; the nurse is direct but not punitive, and the student is able to admit error and ask clarifying questions. Communication is complete and structured, with clear instructions and rationale. Empathy is addressed through subtle attunement (e.g., noticing the student's stress, acknowledging the learning moment), though not sustained. Learning facilitation is clear, with explicit teaching and correction. The relationship is slightly strengthened by the end, with mutual respect and a sense of growth, though warmth remains understated."
S2_A_r01_gemini,S2,A,1,gemini,2,2,2,2,2,10,"The interaction is tense and unsupportive, with the nurse displaying impatience and little regard for the student's emotional state, resulting in minimal psychological safety. Communication is direct but lacks clarity and completeness, as the nurse does not fully explain the error or guide the student. Empathy is absent, and there is no facilitation of learning beyond a demand for correction. The relationship appears strained, with unresolved tension and no evidence of strengthened rapport."
S2_A_r01_gpt4mini,S2,A,1,gpt4mini,2,4,3,3,3,15,"The interaction is tense, with the nurse being curt and the student showing some stress and deference, indicating minimal psychological safety. Communication is clear and complete, but not collaborative. Empathy is briefly acknowledged by the student, but not reciprocated by the nurse. There is some learning facilitation through direct feedback, but it lacks depth or supportive discussion. The relationship remains neutral, with no evident strengthening or damage."
S2_A_r02_claude,S2,A,2,claude,4,4,4,4,4,20,"The nurse provides clear, structured feedback and corrects the student without shaming, maintaining reasonable confidence and mutual respect. Empathy is shown through acknowledgement of the student's insight and encouragement. The learning moment is explicit, with a focus on confirmation bias and proper documentation. The relationship is slightly strengthened by the nurse's supportive comments and follow-up, though the interaction is brisk due to clinical demands."
S2_A_r02_gemini,S2,A,2,gemini,2,4,2,2,2,12,"The nurse maintains a focus on task accuracy and efficiency but offers minimal psychological safety, as the student repeatedly apologizes and is met with curt, corrective responses. Communication is clear and structured regarding expectations, but empathic response is lacking, with emotional cues from the student largely ignored. Learning facilitation is minimal, limited to 'learn from it' without deeper discussion. The relationship continuity is strained, with unresolved tension and little evidence of support or encouragement."
S2_A_r02_gpt4mini,S2,A,2,gpt4mini,3,4,3,3,3,16,"The psychological safety is moderate; the student is hesitant and apologetic, and the nurse is firm but not overtly hostile. Communication is clear and structured, with explicit instructions and expectations. Empathic response is brief—the nurse acknowledges nervousness but focuses on accuracy. Learning facilitation is present but limited to procedural advice rather than deeper insight. Relationship continuity is neutral; the interaction is professional but not warm or meaningfully strengthened."
S2_A_r03_claude,S2,A,3,claude,3,4,3,4,3,17,"The nurse is direct and somewhat brusque, which creates moderate psychological safety; the student is hesitant but not shut down. Communication is clear and structured, with explicit correction and rationale. Empathic response is brief but present—there's acknowledgement of the student's self-correction and effort. Learning facilitation is strong, with a clear teaching moment about documentation and patient safety. Relationship continuity is neutral; the interaction is professional but not warm, though the nurse's subtle affirmation at the end prevents damage."
S2_A_r03_gemini,S2,A,3,gemini,2,4,2,3,2,13,"The psychological safety is low, as the student appears stressed and the nurse is terse, offering little encouragement. Communication clarity is high, with clear instructions and corrections. Empathic response is minimal; the nurse notices the student's apology but does not address the emotional aspect. Learning facilitation is present through direct feedback, but not deeply explored. Relationship continuity is strained, with unresolved tension and little rapport."
S2_A_r03_gpt4mini,S2,A,3,gpt4mini,3,4,3,3,3,16,"The interaction shows moderate psychological safety; the student is hesitant but not shut down, and the nurse is brisk but not overtly hostile. Communication is clear and structured, with specific instructions given. Empathy is minimally present—acknowledgement is brief and mostly procedural. Learning facilitation occurs through correction, but without deeper discussion. The relationship remains neutral; there is no overt damage, but also no clear strengthening."
S2_A_r04_claude,S2,A,4,claude,2,4,2,3,2,13,"Psychological safety is low: the student is apologetic, hesitant, and visibly stressed, with the nurse's brisk, corrective manner offering little reassurance. Communication clarity is strong, as the nurse gives specific, actionable feedback on documentation. Empathic response is minimal; emotional cues are largely ignored. There is some learning facilitation through explicit instruction, but the tone is corrective rather than supportive. Relationship continuity is strained, with unresolved tension and little evidence of rapport or trust-building."
S2_A_r04_gemini,S2,A,4,gemini,2,3,2,2,2,11,"The interaction is terse and directive, with the nurse providing clear instructions but little room for open dialogue or mutual respect, leading to minimal psychological safety. Empathic response is lacking, as the student's apology is not acknowledged emotionally. Learning facilitation is minimal, focusing only on task completion without deeper educational engagement. The relationship appears tense and unresolved, with little evidence of strengthened rapport."
S2_A_r04_gpt4mini,S2,A,4,gpt4mini,2,4,2,3,2,13,"The psychological safety is low; the student appears stressed and apologetic, and the nurse is curt and directive, with little mutual respect or openness. Communication clarity is strong, as expectations are clear and the student confirms understanding. Empathic response is minimal—the nurse notices the student's distress but does not address it. Learning facilitation is present but limited to correction rather than deeper insight. Relationship continuity is tense and unresolved, with the nurse expressing impatience and the student remaining deferential."
S2_A_r05_claude,S2,A,5,claude,3,4,4,4,4,19,"The nurse is brisk and somewhat stern, which creates some pressure and moderate hesitation for the student, but also provides clear, structured feedback and emphasizes the seriousness of accurate documentation. Empathy is present in the form of direct acknowledgment of the student's self-awareness and encouragement to reassess, though not sustained. The learning moment is strong, with explicit teaching about confirmation bias and patient safety. The relationship is slightly strengthened by the nurse's recognition of the student's insight and encouragement, despite the overall briskness."
S2_A_r05_gemini,S2,A,5,gemini,2,3,2,2,2,11,"The interaction is terse and task-focused, with minimal psychological safety as the student appears stressed and the nurse is directive. Communication is mostly clear but lacks structure and confirmation. Empathic response is minimal; the nurse notices the student's apology but does not address it emotionally. Learning facilitation is limited to instructions without explanation. Relationship continuity shows unresolved tension, with little evidence of rapport or support."
S2_A_r05_gpt4mini,S2,A,5,gpt4mini,2,4,3,3,3,15,"The psychological safety is low; the student is apologetic and hesitant, and the nurse is brisk, offering little reassurance. Communication clarity is strong, as the nurse gives direct instructions and the student confirms understanding. Empathic response is minimal—there is brief acknowledgement of the student's feelings but little emotional support. Learning facilitation is present but basic; the nurse emphasizes accuracy and learning by doing, but without deeper reflection. Relationship continuity is neutral; the interaction is professional but lacks warmth or meaningful connection."
S2_B_r01_claude,S2,B,1,claude,3,4,3,4,3,17,"The psychological safety is moderate; the student is hesitant and apologetic, and the nurse is brisk, offering little emotional support, though not overtly hostile. Communication clarity is strong, with structured feedback and SBAR guidance, though some minor omissions in emotional checking. Empathic response is brief—mistakes are acknowledged but not deeply explored emotionally. Learning facilitation is clear, with explicit correction and rationale, supporting educational value. Relationship continuity is neutral; the interaction is professional but not warm, and the nurse's demeanor is brisk but not damaging."
S2_B_r01_gemini,S2,B,1,gemini,3,4,3,4,3,17,"The student demonstrates moderate hesitation and some self-doubt, indicating only partial psychological safety. Communication is generally clear and structured, especially with mediator prompts, though the student's responses are sometimes incomplete. Empathic responses are brief and mostly limited to acknowledgments. Learning facilitation is strong due to repeated mediator guidance and explicit educational moments. The relationship remains neutral—there is no overt tension, but also no clear strengthening."
S2_B_r01_gpt4mini,S2,B,1,gpt4mini,4,4,4,4,4,20,"The dialogue demonstrates reasonable confidence and mutual respect, with the student openly acknowledging errors and the nurse providing direct but constructive feedback. Communication is clear and structured, with SBAR principles modeled and reinforced. Empathy is addressed through supportive mediator comments and acknowledgment of the student's efforts. Learning is facilitated by explicit guidance and correction, and the relationship is slightly strengthened through respectful, responsible exchanges."
S2_B_r02_claude,S2,B,2,claude,4,4,4,4,4,20,"The dialogue demonstrates reasonable confidence and mutual respect, with the student persisting despite pressure and the nurse providing direct but ultimately supportive feedback. Communication is clear and structured, with SBAR guidance and explicit action steps. Emotional acknowledgement is present, with the nurse briefly softening and the mediator offering support. Learning is facilitated through specific feedback and correction, and the relationship is slightly strengthened by the nurse's final gesture of satisfaction and acknowledgment of the student's initiative."
S2_B_r02_gemini,S2,B,2,gemini,3,3,4,4,3,17,"The dialogue demonstrates moderate psychological safety; the student hesitates and apologizes, indicating some stress, but is not completely shut down. Communication clarity is fair, with minor omissions as the student struggles to articulate needs, though the mediator provides structured SBAR guidance. Empathic response is addressed by the mediator, who repeatedly normalizes uncertainty and offers reassurance. Learning facilitation is clear, with multiple educational prompts and SBAR modeling. Relationship continuity is neutral; the nurse is terse but not overtly hostile, and the student remains engaged, though the interaction lacks warmth or clear strengthening."
S2_B_r02_gpt4mini,S2,B,2,gpt4mini,3,4,3,4,3,17,"The dialogue demonstrates moderate psychological safety; the student shows some hesitation and stress but continues to engage. Communication is generally clear and structured, especially with repeated SBAR prompts, though the nurse's responses are terse. Empathic responses are brief, mostly from the mediator, with little sustained attunement. There are clear learning moments facilitated by the mediator, though the nurse offers minimal educational support. The relationship remains neutral—professional but not meaningfully strengthened or damaged."
S2_B_r03_claude,S2,B,3,claude,4,4,4,4,4,20,"The student demonstrates reasonable confidence and openness to feedback, responding respectfully and clarifying their plan. Communication is clear and structured, with SBAR guidance and explicit confirmation of next steps. Empathic response is present, with emotional acknowledgement and respectful interactions. Learning facilitation is strong, with explicit correction, rationale, and modeling of best practices. The relationship is slightly strengthened through accountability and mutual respect, though the nurse remains somewhat brisk and task-focused."
S2_B_r03_gemini,S2,B,3,gemini,2,4,4,4,2,16,"The environment is tense, with the nurse being quite directive and critical, leading to minimal psychological safety for the student (PS=2). Communication is clear and structured, with repeated SBAR prompts and explicit action steps (CC=4). Empathic responses from the mediator acknowledge the student's pressure and offer support (ER=4). Learning facilitation is present, as the mediator provides actionable feedback and models responses (LF=4). However, the relationship continuity is strained, with unresolved tension and little warmth from the nurse (RC=2)."
S2_B_r03_gpt4mini,S2,B,3,gpt4mini,4,4,4,4,4,20,"The dialogue demonstrates reasonable confidence and mutual respect, with the student expressing uncertainty but receiving supportive, clear guidance from both the nurse and mediator. Communication is structured and complete, with SBAR principles and documentation protocols explained and confirmed. Emotional responses are acknowledged and addressed, and there are clear learning moments as the student gains understanding. The relationship is slightly strengthened, with encouragement and openness for future questions."
S2_B_r04_claude,S2,B,4,claude,4,4,4,4,4,20,"The dialogue demonstrates reasonable psychological safety; the student is nervous but remains engaged and receptive to feedback. Communication is clear and structured, with the student accurately summarizing instructions and confirming understanding. Empathic response is present, as the student acknowledges mistakes and expresses willingness to learn, and the nurse provides direct but constructive feedback. Learning facilitation is clear, with explicit teaching moments and actionable guidance. Relationship continuity is slightly strengthened, as the nurse's final subtle acknowledgment suggests respect for the student's effort and growth."
S2_B_r04_gemini,S2,B,4,gemini,3,4,4,4,3,18,"The student demonstrates moderate hesitation and some nervousness, but psychological safety is maintained at a basic level. Communication is generally clear and structured, with mediator support ensuring accuracy. Empathic responses are present, with both mediator and nurse acknowledging the student's feelings and encouraging focus. Learning facilitation is strong, with repeated modeling and feedback. The relationship remains neutral, with no clear strengthening or damage."
S2_B_r04_gpt4mini,S2,B,4,gpt4mini,4,4,4,4,4,20,"The dialogue demonstrates reasonable psychological safety, with the student expressing uncertainty but receiving clear, nonjudgmental guidance from both the nurse and mediator. Communication is structured and complete, with repeated clarification of expectations. Empathic responses are present, especially from the mediator, who normalizes uncertainty and encourages the student. Learning facilitation is clear, as the student is coached through the correction process. The relationship appears slightly strengthened by the end, with the nurse offering future support and the student expressing appreciation."
