session_id,scenario,condition,run,actor_model,PS,CC,ER,LF,RC,total,rationale
S3_A_r04_gemini,S3,A,4,gemini,2,3,2,2,2,11,"The psychological safety is low; the student appears stressed and is hurried by the nurse, who is abrupt and unsupportive. Communication clarity is moderate: the student provides key observations but lacks complete data, and the nurse requests specifics. Empathic response is minimal—the nurse notices the student's concern but does not address their anxiety. Learning facilitation is minimal, as the nurse gives instructions without explanation or support. Relationship continuity is poor, with unresolved tension and a transactional tone."
S3_A_r04_gpt4mini,S3,A,4,gpt4mini,2,4,3,3,2,14,"The psychological safety is low; the student appears hesitant and the nurse is terse, offering little reassurance. Communication clarity is strong, with structured reporting and clear instructions. Empathic response is minimal—there is brief acknowledgement but little emotional support. Learning facilitation is present but not explicit; instructions are given, but there's no deeper discussion or reflection. Relationship continuity is strained, with unresolved tension and a transactional tone."
S3_A_r05_claude,S3,A,5,claude,3,4,4,4,3,18,"The student demonstrates moderate hesitation and anxiety, but is able to communicate key clinical findings; the nurse is brisk and demanding but provides clear expectations and reinforces the importance of acting on clinical instincts. Empathy is addressed through acknowledgment of the student's actions and reassurance, though the tone is stern rather than warm. There is a clear learning moment about trusting clinical judgment and the urgency of response. The relationship is neutral to slightly positive, with no overt damage but also little explicit encouragement."
S3_A_r05_gemini,S3,A,5,gemini,2,3,2,2,2,11,"The nurse's communication is terse and somewhat dismissive, creating a stressed environment with minimal psychological safety for the student. Communication clarity is moderate, as the nurse requests specific information but does not guide the student through the process. Empathic response is minimal; the student's uncertainty is noticed but not addressed supportively. Learning facilitation is limited to correction without explanation or encouragement. The relationship continuity is strained, with unresolved tension and no evidence of strengthened rapport."
S3_A_r05_gpt4mini,S3,A,5,gpt4mini,3,4,3,3,3,16,"The psychological safety is moderate; the student hesitates and apologizes, indicating some stress, though the nurse is direct but not overtly hostile. Communication clarity is strong, with a structured report and clear instructions. Empathic response is brief; the nurse acknowledges the student's apology but quickly redirects to the task. Learning facilitation is present but limited to task-oriented guidance. Relationship continuity is neutral—the interaction is professional but lacks warmth or meaningful connection."
S3_B_r01_claude,S3,B,1,claude,4,5,4,5,4,22,"The transcript demonstrates reasonable psychological safety; the student is nervous but supported by both the mediator and nurse, who provide clear, constructive feedback. Communication is clear, structured, and complete, especially as the student progresses to using SBAR/ISBAR. Empathic response is addressed, with the nurse and mediator acknowledging the student's stress and efforts. Learning facilitation is strong, with explicit teaching moments and feedback. The relationship is slightly strengthened by the end, with the nurse affirming the student's actions and competence."
S3_B_r01_gemini,S3,B,1,gemini,3,4,3,4,3,17,"The student demonstrates moderate hesitation and stress, but persists in communicating despite a brusque nurse. Communication is mostly complete and structured, guided by repeated SBAR prompts, though some details are delayed. Empathic response is brief, with minimal emotional acknowledgement from the nurse and only supportive mediator comments. Learning facilitation is clear, with repeated, practical SBAR coaching. The relationship remains neutral; there is tension but no overt damage or strengthening."
S3_B_r01_gpt4mini,S3,B,1,gpt4mini,3,4,3,4,3,17,"The student demonstrates moderate psychological safety, showing some hesitation and anxiety under pressure but continues to communicate and follow instructions. Communication clarity is strong, with structured, complete exchanges and repeated SBAR guidance. Empathic response is brief; emotional concerns are acknowledged but not deeply addressed. Learning facilitation is clear, with explicit educational moments from the mediator. Relationship continuity remains neutral, as the nurse is brisk and the student is anxious, but no harm is done."
S3_B_r02_claude,S3,B,2,claude,5,5,5,5,5,25,"The dialogue demonstrates high psychological safety, with the nurse providing clear validation and encouragement, allowing the student to move from hesitancy to confident action. Communication is structured, accurate, and complete, with SBAR principles modeled and reinforced. Empathic responses are sustained throughout, acknowledging both the student's emotions and the patient's humanity. Learning facilitation is explicit and deep, with real-time feedback, modeling, and insight into clinical reasoning. The relationship is meaningfully strengthened, with mutual respect and trust clearly established."
S3_B_r02_gemini,S3,B,2,gemini,2,2,2,3,2,11,"The student repeatedly hesitates and apologizes, showing minimal confidence and psychological safety. Communication clarity is poor, with critical information not delivered despite multiple prompts. Empathic response is minimal; the nurse is brusque and the student's anxiety is acknowledged only by the mediator, not the nurse. Learning facilitation is present through mediator coaching, but the student struggles to apply it. Relationship continuity is strained, with unresolved tension and no evidence of rapport building."
S3_B_r02_gpt4mini,S3,B,2,gpt4mini,3,4,3,4,3,17,"The student demonstrates moderate confidence but shows some hesitation and deference in the face of the nurse's brusque responses, indicating only moderate psychological safety. Communication is generally clear and structured, with SBAR elements present, though not always fully confirmed. Empathic response is brief; the nurse is curt and the student acknowledges but does not deeply address emotion. Learning facilitation is strong due to repeated mediator guidance and clear learning moments. Relationship continuity is neutral; the interaction is professional but not meaningfully strengthened, with some tension remaining."
S3_B_r03_claude,S3,B,3,claude,4,4,4,4,4,20,"The student demonstrates reasonable confidence, gradually becoming more assertive and structured in communication, especially after feedback. Communication is clear and complete, with minor initial hedging but ultimately accurate reporting using SBAR elements. Empathic responses are present, both to the patient and in the nurse's supportive feedback. Learning is facilitated through direct feedback and modeling, and the relationship between student and nurse is strengthened by positive reinforcement and collaborative action."
S3_B_r03_gemini,S3,B,3,gemini,3,3,3,4,3,16,"The student demonstrates moderate hesitation and stress, reflecting only partial psychological safety. Communication is incomplete, with some prompting needed and minor omissions in clarity. Empathic responses are brief but present, mainly from the mediator. Learning facilitation is clear, with repeated SBAR coaching and encouragement. Relationship continuity is neutral; the interaction is tense but not overtly damaging."
S3_B_r03_gpt4mini,S3,B,3,gpt4mini,4,4,4,4,4,20,"The student demonstrates reasonable confidence, gradually improving with mediator support, and the nurse maintains a professional, if brisk, tone. Communication is structured and complete, following SBAR guidance, though some initial hesitancy and minor gaps are present. Emotional responses are acknowledged and addressed, with both mediator and nurse providing support and feedback. Learning is facilitated through repeated SBAR coaching and real-time feedback. The relationship is slightly strengthened by mutual respect and encouragement, despite the nurse's directness."
S3_B_r04_claude,S3,B,4,claude,5,5,5,5,5,25,"This transcript demonstrates a highly supportive and psychologically safe environment, with the nurse providing clear validation, structured feedback, and explicit encouragement throughout. Communication is complete, accurate, and follows SBAR structure, with repeated confirmation and modeling. Empathic responses are sustained, with emotional states acknowledged and addressed for both patient and student. Learning facilitation is deep, with real-time teaching, reflective prompts, and skill demonstration. The relationship is meaningfully strengthened, with mutual respect and trust evident by the end."
S3_B_r04_gemini,S3,B,4,gemini,2,2,2,3,2,11,"The student demonstrates significant stress and hesitation, with repeated interruptions and difficulty communicating clearly, indicating low psychological safety and clarity. Empathic responses are minimal, with little emotional acknowledgement from the nurse. Learning facilitation is present due to mediator coaching, but the student struggles to apply it. The relationship shows unresolved tension, with the nurse remaining impatient and the student apologetic."
S3_B_r04_gpt4mini,S3,B,4,gpt4mini,3,4,4,4,3,18,"The student demonstrates moderate hesitation and uncertainty, but continues to participate and follow instructions, indicating a psychologically safe but somewhat pressured environment (PS=3). Communication is mostly complete and structured, with repeated SBAR coaching and accurate updates (CC=4). Empathic responses are present from the mediator, who acknowledges the student's feelings and encourages them (ER=4). Learning facilitation is clear, with stepwise guidance and feedback, though deep insight is not fully demonstrated (LF=4). The relationship remains professional and neutral, with some tension but no damage or meaningful strengthening (RC=3)."
S3_B_r05_claude,S3,B,5,claude,4,5,4,5,5,23,"The student demonstrates increasing confidence and is met with respect and encouragement from the nurse, supporting psychological safety (4). Communication is clear, structured, and complete, with SBAR principles explicitly modeled and confirmed (5). The nurse acknowledges the student's emotions and efforts, providing supportive feedback and guidance (4). There are multiple explicit learning moments, including real-time teaching and encouragement to reflect and prepare for future situations (5). The relationship is meaningfully strengthened, with trust and mutual respect established by the end (5)."
S3_B_r05_gemini,S3,B,5,gemini,3,3,4,4,3,17,"The student demonstrates moderate hesitation and stress, likely due to the nurse's brusque tone, but is supported by the mediator and continues to participate. Communication clarity is hampered by incomplete delivery of information, though the mediator provides structured SBAR guidance. Empathic response is addressed by the mediator, who repeatedly reassures the student. Learning facilitation is clear, with repeated, specific SBAR coaching. Relationship continuity is neutral; the interaction is tense but not overtly damaging."
S3_B_r05_gpt4mini,S3,B,5,gpt4mini,3,4,3,4,3,17,"The student demonstrates moderate psychological safety, showing some hesitation but continuing to communicate under pressure. Communication clarity is strong, with structured, mostly complete SBAR elements. Empathic response is brief; emotional stress is acknowledged but not deeply addressed. Learning facilitation is clear, with repeated SBAR coaching and actionable feedback. Relationship continuity is neutral—the interaction is professional but tense, with no overt strengthening or damage."
S3_C_r01_claude,S3,C,1,claude,4,5,4,5,4,22,"The communication demonstrates clear structure, accuracy, and completeness, with the nurse providing explicit instructions and rationale for each action (CC=5). Psychological safety is reasonable; the nurse is direct but acknowledges the student's correct actions and encourages prompt escalation (PS=4). Empathic response is addressed, with the nurse affirming the student's decisions and providing supportive feedback (ER=4). Learning facilitation is strong, with clear teaching moments about urgency, vital signs, and escalation (LF=5). The relationship is slightly strengthened through mutual respect and constructive feedback, though the tone is brisk due to urgency (RC=4)."
S3_C_r01_gemini,S3,C,1,gemini,2,3,2,4,2,13,"The psychological safety is low, as the student is hesitant and apologetic, and the nurse is terse and demanding, creating a stressed environment. Communication clarity is moderate; while key data are eventually elicited, there are minor omissions and repeated prompts for structure. Empathic response is minimal, with little emotional support or acknowledgement of the student's distress. Learning facilitation is clear, as the nurse provides direct feedback and instruction on SBAR, but the tone is pressured. Relationship continuity is strained, with unresolved tension and no evidence of strengthened rapport."
S3_C_r01_gpt4mini,S3,C,1,gpt4mini,4,4,4,4,4,20,"The communication demonstrates reasonable confidence and mutual respect, with the student expressing uncertainty but being supported and guided clearly by the nurse. Information is conveyed accurately and completely, with structured updates and instructions. Emotional concerns (student uncertainty and worry) are acknowledged and addressed with supportive, directive responses. The dialogue provides clear learning moments through stepwise escalation and rationale for actions. The relationship is slightly strengthened through effective teamwork and ongoing support."
S3_C_r02_claude,S3,C,2,claude,4,5,4,5,4,22,"The exchange demonstrates reasonable psychological safety—the student is initially hesitant but receives clear, direct guidance and affirmation, leading to increased confidence. Communication is complete, structured, and accurate, with information confirmed and SBAR principles applied. Emotional responses are acknowledged and addressed, especially as the nurse affirms the student's actions and provides supportive feedback. Learning facilitation is strong, with explicit teaching, rationale for actions, and reinforcement of good decisions. The relationship is slightly strengthened by mutual respect and clear teamwork, though the nurse's tone is brisk rather than warmly collaborative."
S3_C_r02_gemini,S3,C,2,gemini,2,2,2,2,2,10,"The interaction is tense, with the nurse displaying impatience and the student showing significant hesitation and confusion, indicating low psychological safety. Communication clarity is poor due to repeated confusion about the room number and lack of concrete clinical information. Empathic response is minimal, with little emotional acknowledgement from either party. There is little evidence of learning facilitation, as the exchange is stressful and corrective rather than educational. Relationship continuity is strained, with unresolved tension and no sign of strengthened rapport."
S3_C_r02_gpt4mini,S3,C,2,gpt4mini,4,4,4,4,4,20,"The dialogue demonstrates reasonable confidence and mutual respect, with the student expressing uncertainty but being supported and guided by the nurse. Communication is clear and structured, with instructions confirmed and safety emphasized. Emotional responses are acknowledged and addressed, fostering a supportive environment. Learning is facilitated through direct feedback and encouragement, and the relationship is slightly strengthened by positive reinforcement and availability for support."
S3_C_r03_claude,S3,C,3,claude,4,5,4,5,4,22,"The interaction demonstrates reasonable psychological safety, with the student expressing some initial hesitation but ultimately being supported and affirmed by the nurse. Communication is clear, structured, and complete, especially as the situation escalates. Empathic response is addressed, with the nurse acknowledging the student's actions and encouraging trust in clinical instincts. There are strong learning moments, with explicit feedback and rationale provided. The relationship is slightly strengthened by the supportive feedback and encouragement for future escalation."
S3_C_r03_gemini,S3,C,3,gemini,3,3,3,3,3,15,"The interaction demonstrates moderate psychological safety; the student hesitates and apologizes repeatedly, indicating some stress, but is able to communicate concerns. Communication clarity is fair, with some omissions (no exact vitals), but the main issue is conveyed. Empathic response is minimal—there is brief acknowledgement of the student's difficulty but no emotional support. Learning facilitation is present but limited; the nurse gives clear instructions but does not provide deeper teaching. Relationship continuity is neutral, with no overt conflict but also no evident strengthening."
S3_C_r03_gpt4mini,S3,C,3,gpt4mini,4,4,3,4,4,19,"The dialogue demonstrates reasonable psychological safety, with the student expressing uncertainty but being met with clear, structured responses and guidance. Communication is complete and structured, though not explicitly confirmed in a closed-loop manner. Empathic response is present at a basic level, with brief acknowledgments but limited emotional attunement. Learning facilitation is clear, as the student is guided through appropriate actions and escalation steps. The relationship appears slightly strengthened by the supportive and collaborative tone throughout."
S3_C_r04_claude,S3,C,4,claude,3,4,3,4,3,17,"The student demonstrates moderate psychological safety, hesitating but persisting in raising concerns. Communication is clear and structured, with specific clinical details provided. Empathic response is brief but present, as the student expresses concern for the patient. There is a clear learning moment regarding urgency and sepsis management, though the interaction is brisk and somewhat tense. Relationship continuity is neutral; the exchange is professional but not notably warm or strengthened."
S3_C_r04_gemini,S3,C,4,gemini,2,1,2,2,2,9,"The interaction demonstrates minimal psychological safety, as the student appears hesitant and the nurse is impatient and demanding. Communication clarity is critically lacking, with no substantive information exchanged about the patient's condition. Empathic response is minimal; emotional cues are largely ignored. Learning facilitation is also minimal, with no constructive feedback or educational moments. Relationship continuity is strained, with unresolved tension and no evidence of rapport-building."
S3_C_r04_gpt4mini,S3,C,4,gpt4mini,2,4,3,3,3,15,"The communication shows significant stress and minimal psychological safety, with the student repeatedly apologizing and the nurse being terse and directive. Clarity is strong, as information is relayed accurately and tasks are clearly assigned. Empathic response is limited to brief acknowledgements, with little emotional support. Learning facilitation is present but basic, as the student is corrected and given instructions but not deeply engaged. The relationship remains neutral, with no overt damage but also no meaningful strengthening."
S3_C_r05_claude,S3,C,5,claude,4,5,4,5,5,23,"The dialogue demonstrates strong communication clarity, with structured, complete information and confirmation at each step. Psychological safety is reasonable, as the student is initially hesitant but receives clear, supportive guidance and positive reinforcement. Empathic response is addressed, with the student's concerns and emotional state acknowledged and validated. Learning facilitation is excellent, with explicit feedback and rationale provided, fostering deep learning. The relationship is meaningfully strengthened through encouragement and trust-building."
S3_C_r05_gemini,S3,C,5,gemini,2,3,2,3,3,13,"The nurse's communication is terse and somewhat dismissive, which likely creates stress and minimal psychological safety for the student. Clarity is moderate, as the essential information is eventually communicated, but the process is fragmented and pressured. Empathic response is minimal; emotional cues from the student are largely ignored. There is some learning facilitation as the student is prompted to provide objective findings, but it lacks supportive guidance. The relationship is neutral—there is no overt damage, but no strengthening either."
S3_C_r05_gpt4mini,S3,C,5,gpt4mini,4,4,3,4,4,19,"The dialogue demonstrates reasonable psychological safety, with the student expressing uncertainty but being met with clear, nonjudgmental instructions. Communication is structured and complete, though not explicitly confirmed in a formal framework. Empathic response is present but brief, focusing on task support rather than emotional attunement. Learning facilitation is clear, with the student receiving actionable feedback and clarification. The relationship appears slightly strengthened, with ongoing collaboration and open lines for further assistance."
S3_D_r01_claude,S3,D,1,claude,4,4,4,4,4,20,"The nurse responds with directness and increasing support, especially as the situation escalates, which helps the student gain confidence and act decisively. Communication is clear and structured, with clinical details elicited and confirmed. Empathic responses are present, particularly as the nurse acknowledges the student's actions and reassures them. Learning is facilitated through real-time feedback and validation of the student's instincts. The relationship is strengthened by the end, with mutual respect and trust established, though the tone remains brisk rather than deeply attuned."
S3_D_r01_gemini,S3,D,1,gemini,2,3,2,2,2,11,"The nurse's responses are terse and directive, creating a pressured environment that limits psychological safety and does not acknowledge the student's anxiety or effort. Communication is somewhat complete but lacks structure and confirmation. Empathic response is minimal, with little emotional support. Learning facilitation is limited to instructions without explanation or encouragement. The relationship is strained, with unresolved tension and little evidence of support or mutual respect."
S3_D_r01_gpt4mini,S3,D,1,gpt4mini,3,4,3,3,3,16,"The student expresses anxiety and uncertainty throughout, and while the nurse is direct and action-oriented, there is limited explicit emotional support or encouragement. Communication is clear and structured, with appropriate clinical actions taken, but empathic responses are brief and not sustained. Learning facilitation occurs through task delegation and some explanation, but deeper reflection or insight is lacking. The relationship remains professional but neutral, with no significant strengthening or damage."
S3_D_r02_claude,S3,D,2,claude,5,5,5,5,5,25,"The dialogue demonstrates a high level of psychological safety, with the nurse explicitly validating the student's concerns and encouraging her to speak up and participate. Communication is clear, structured, and complete, especially during the MET call and handover, following ISBAR principles. Empathic responses are sustained throughout, with the nurse acknowledging the student's anxiety and providing reassurance. Learning facilitation is strong, as the nurse turns each step into a teaching moment and supports the student's clinical reasoning. The relationship is meaningfully strengthened, with explicit praise and trust, culminating in a sense of mutual respect and professional growth."
S3_D_r02_gemini,S3,D,2,gemini,2,3,2,2,2,11,"The nurse's responses are terse and directive, with little emotional support or encouragement, leading to visible student anxiety and hesitation (low PS, ER). Communication is mostly accurate but lacks structure and confirmation (CC=3). There is minimal facilitation of learning, as the nurse does not involve the student in reasoning or assessment (LF=2). The relationship feels tense and unresolved, with the student appearing stressed and the nurse not addressing this (RC=2)."
S3_D_r02_gpt4mini,S3,D,2,gpt4mini,3,4,3,4,3,17,"The communication demonstrates moderate psychological safety; the student is anxious and hesitant, and the nurse is direct but not overtly dismissive. Clarity is good, with structured requests for information and clear instructions. Empathic response is brief, with some acknowledgement of the student's anxiety but little sustained support. There is a clear learning moment as the nurse guides the student through assessment and action. Relationship continuity is neutral; the interaction is professional but lacks warmth or meaningful strengthening."
S3_D_r03_claude,S3,D,3,claude,4,5,4,5,4,22,"The dialogue demonstrates strong communication clarity, with the student providing a complete and structured handover and the nurse reinforcing the use of ISBAR. Psychological safety is reasonable; the nurse is direct but ultimately supportive, and the student becomes more confident. Empathic response is addressed, with the nurse acknowledging the student's anxiety and progress. Learning facilitation is excellent, with explicit teaching moments and reinforcement of critical thinking. Relationship continuity is slightly strengthened, as the nurse validates the student's actions and encourages future speaking up."
